{
  "schema_version": "g13a.v1",
  "tool": "tools/uni_cluster_review_packet_g13_a.py",
  "base_commit": "6db979d69d924bf191637354c91949009d010967",
  "source_reports": {
    "g11_priority": {
      "path": "docs/coordination/UNI_REDUNDANCY_PRIORITY_G11_A.json",
      "schema_version": "g11a.v1",
      "sha256": "eb4342042a45dd2645012fed073b43535ed254bd746a55380df6200ac40101e6"
    },
    "g12_decision_contract": {
      "path": "docs/coordination/UNI_CLUSTER_REVIEW_G12_A.json",
      "schema_version": "g12a.v1",
      "sha256": "e1e8d6fdbd801d520b59076fc9a48aed82b326a804436c6e2729a83822b7bc40"
    },
    "g4_pack_exam_map": {
      "path": "docs/coordination/UNI_PACK_EXAM_MAP_G4.json",
      "schema_version": "g4.v1",
      "sha256": "ee897e3af02ef960485f9385134ef14caa1827039368c812aab9c1620662c0fe"
    }
  },
  "scope": {
    "index_level": "g11_connected_component",
    "human_review_required": true,
    "answers_read": false,
    "didactic_content_copied": false,
    "didactic_content_modified": false,
    "deduplication_performed": false,
    "automatic_merge_or_reject": false,
    "decision_made": false,
    "source_of_truth": "G11 priority + G12 decision contract + G4 observed pack/exam metadata"
  },
  "review_contract": {
    "source": "docs/coordination/UNI_CLUSTER_REVIEW_G12_A.json",
    "schema_version": "g12a.v1",
    "initial_decision": null,
    "allowed_decisions": [
      "distinct",
      "merge_candidate",
      "reject_candidate",
      "needs_source_review"
    ],
    "evidence_ref_required_for_non_null_decision": true,
    "reviewer_required": true,
    "rationale_required": true,
    "decision_is_not_an_action": true
  },
  "coverage": {
    "cluster_count": 85,
    "batch_count": 9,
    "pending_count": 85,
    "decided_count": 0,
    "all_decisions_null": true,
    "all_reviewers_null": true,
    "all_rationales_null": true,
    "all_evidence_refs_null": true
  },
  "batches": [
    {
      "batch_id": "batch-01",
      "priority_rank_start": 1,
      "priority_rank_end": 10,
      "cluster_count": 10,
      "cluster_ids": [
        "component-0036",
        "component-0025",
        "component-0033",
        "component-0001",
        "component-0002",
        "component-0004",
        "component-0007",
        "component-0011",
        "component-0012",
        "component-0022"
      ],
      "pending_count": 10
    },
    {
      "batch_id": "batch-02",
      "priority_rank_start": 11,
      "priority_rank_end": 20,
      "cluster_count": 10,
      "cluster_ids": [
        "component-0071",
        "component-0072",
        "component-0073",
        "component-0074",
        "component-0075",
        "component-0076",
        "component-0079",
        "component-0080",
        "component-0083",
        "component-0084"
      ],
      "pending_count": 10
    },
    {
      "batch_id": "batch-03",
      "priority_rank_start": 21,
      "priority_rank_end": 30,
      "cluster_count": 10,
      "cluster_ids": [
        "component-0081",
        "component-0082",
        "component-0003",
        "component-0005",
        "component-0009",
        "component-0010",
        "component-0024",
        "component-0028",
        "component-0032",
        "component-0035"
      ],
      "pending_count": 10
    },
    {
      "batch_id": "batch-04",
      "priority_rank_start": 31,
      "priority_rank_end": 40,
      "cluster_count": 10,
      "cluster_ids": [
        "component-0037",
        "component-0038",
        "component-0039",
        "component-0043",
        "component-0048",
        "component-0051",
        "component-0052",
        "component-0050",
        "component-0006",
        "component-0008"
      ],
      "pending_count": 10
    },
    {
      "batch_id": "batch-05",
      "priority_rank_start": 41,
      "priority_rank_end": 50,
      "cluster_count": 10,
      "cluster_ids": [
        "component-0013",
        "component-0014",
        "component-0015",
        "component-0016",
        "component-0017",
        "component-0018",
        "component-0019",
        "component-0020",
        "component-0021",
        "component-0023"
      ],
      "pending_count": 10
    },
    {
      "batch_id": "batch-06",
      "priority_rank_start": 51,
      "priority_rank_end": 60,
      "cluster_count": 10,
      "cluster_ids": [
        "component-0026",
        "component-0027",
        "component-0029",
        "component-0030",
        "component-0031",
        "component-0034",
        "component-0040",
        "component-0041",
        "component-0042",
        "component-0044"
      ],
      "pending_count": 10
    },
    {
      "batch_id": "batch-07",
      "priority_rank_start": 61,
      "priority_rank_end": 70,
      "cluster_count": 10,
      "cluster_ids": [
        "component-0045",
        "component-0046",
        "component-0047",
        "component-0049",
        "component-0053",
        "component-0054",
        "component-0055",
        "component-0056",
        "component-0057",
        "component-0058"
      ],
      "pending_count": 10
    },
    {
      "batch_id": "batch-08",
      "priority_rank_start": 71,
      "priority_rank_end": 80,
      "cluster_count": 10,
      "cluster_ids": [
        "component-0059",
        "component-0060",
        "component-0061",
        "component-0062",
        "component-0063",
        "component-0064",
        "component-0065",
        "component-0066",
        "component-0067",
        "component-0068"
      ],
      "pending_count": 10
    },
    {
      "batch_id": "batch-09",
      "priority_rank_start": 81,
      "priority_rank_end": 85,
      "cluster_count": 5,
      "cluster_ids": [
        "component-0069",
        "component-0070",
        "component-0077",
        "component-0078",
        "component-0085"
      ],
      "pending_count": 5
    }
  ],
  "clusters": [
    {
      "cluster_id": "component-0036",
      "priority_rank": 1,
      "priority_key": {
        "collision_count": 78,
        "coverage_count": 1,
        "pack_count": 0,
        "exam_count": 1,
        "node_count": 13,
        "source_group": "public_exams",
        "component_id": "component-0036"
      },
      "g11": {
        "source_group": "public_exams",
        "collision_count": 78,
        "unit_count": 13,
        "unit_refs": [
          "exam:UNIVERSITA_EDILIZIA/ESAMI/IMPIANTI_FV_EOLICO/domande.md#question-0174",
          "exam:UNIVERSITA_EDILIZIA/ESAMI/IMPIANTI_FV_EOLICO/domande.md#question-0202",
          "exam:UNIVERSITA_EDILIZIA/ESAMI/IMPIANTI_FV_EOLICO/domande.md#question-0335",
          "exam:UNIVERSITA_EDILIZIA/ESAMI/IMPIANTI_FV_EOLICO/domande.md#question-0339",
          "exam:UNIVERSITA_EDILIZIA/ESAMI/IMPIANTI_FV_EOLICO/domande.md#question-0549",
          "exam:UNIVERSITA_EDILIZIA/ESAMI/IMPIANTI_FV_EOLICO/domande.md#question-0557",
          "exam:UNIVERSITA_EDILIZIA/ESAMI/IMPIANTI_FV_EOLICO/domande.md#question-0633",
          "exam:UNIVERSITA_EDILIZIA/ESAMI/IMPIANTI_FV_EOLICO/domande.md#question-0695",
          "exam:UNIVERSITA_EDILIZIA/ESAMI/IMPIANTI_FV_EOLICO/domande.md#question-0719",
          "exam:UNIVERSITA_EDILIZIA/ESAMI/IMPIANTI_FV_EOLICO/domande.md#question-0826",
          "exam:UNIVERSITA_EDILIZIA/ESAMI/IMPIANTI_FV_EOLICO/domande.md#question-0871",
          "exam:UNIVERSITA_EDILIZIA/ESAMI/IMPIANTI_FV_EOLICO/domande.md#question-0917",
          "exam:UNIVERSITA_EDILIZIA/ESAMI/IMPIANTI_FV_EOLICO/domande.md#question-0921"
        ]
      },
      "references": {
        "exam_refs": [
          {
            "exam_id": "IMPIANTI_FV_EOLICO",
            "exam_path": "UNIVERSITA_EDILIZIA/ESAMI/IMPIANTI_FV_EOLICO",
            "classification": "unmatched_exam",
            "legacy_observed": true,
            "source_files": [
              "UNIVERSITA_EDILIZIA/ESAMI/IMPIANTI_FV_EOLICO/domande.md",
              "UNIVERSITA_EDILIZIA/ESAMI/README.md"
            ]
          }
        ],
        "pack_refs": [],
        "pack_reference_mode": "observed_g4_candidates_preserved"
      },
      "batch": {
        "batch_id": "batch-01",
        "batch_rank": 1
      },
      "g12_contract_ref": "docs/coordination/UNI_CLUSTER_REVIEW_G12_A.json#component-0036",
      "review": {
        "decision": null,
        "evidence_ref": null,
        "reviewer": null,
        "rationale": null
      }
    },
    {
      "cluster_id": "component-0025",
      "priority_rank": 2,
      "priority_key": {
        "collision_count": 10,
        "coverage_count": 1,
        "pack_count": 0,
        "exam_count": 1,
        "node_count": 5,
        "source_group": "public_exams",
        "component_id": "component-0025"
      },
      "g11": {
        "source_group": "public_exams",
        "collision_count": 10,
        "unit_count": 5,
        "unit_refs": [
          "exam:UNIVERSITA_EDILIZIA/ESAMI/IMPIANTI_FV_EOLICO/domande.md#question-0083",
          "exam:UNIVERSITA_EDILIZIA/ESAMI/IMPIANTI_FV_EOLICO/domande.md#question-0201",
          "exam:UNIVERSITA_EDILIZIA/ESAMI/IMPIANTI_FV_EOLICO/domande.md#question-0720",
          "exam:UNIVERSITA_EDILIZIA/ESAMI/IMPIANTI_FV_EOLICO/domande.md#question-0966",
          "exam:UNIVERSITA_EDILIZIA/ESAMI/IMPIANTI_FV_EOLICO/domande.md#question-0976"
        ]
      },
      "references": {
        "exam_refs": [
          {
            "exam_id": "IMPIANTI_FV_EOLICO",
            "exam_path": "UNIVERSITA_EDILIZIA/ESAMI/IMPIANTI_FV_EOLICO",
            "classification": "unmatched_exam",
            "legacy_observed": true,
            "source_files": [
              "UNIVERSITA_EDILIZIA/ESAMI/IMPIANTI_FV_EOLICO/domande.md",
              "UNIVERSITA_EDILIZIA/ESAMI/README.md"
            ]
          }
        ],
        "pack_refs": [],
        "pack_reference_mode": "observed_g4_candidates_preserved"
      },
      "batch": {
        "batch_id": "batch-01",
        "batch_rank": 2
      },